{
  "schemaVersion": 1,
  "artifactType": "migration-map",
  "skill": "flow-plan",
  "skillVersion": "0.2.0",
  "runId": "migration-map-2",
  "repository": {
    "root": "C:\\Project\\frontend",
    "revision": "03bb7e90a09b1e56b75801d03d7eb349828f0b59"
  },
  "supersedes": {
    "path": "runs\\2026-09-14-migration-map-1\\migration-map.json",
    "sha256": "88f1088916083b464eba1f32aebe8818205ab114a3bb9cd3de3824b750e4a396",
    "runId": "migration-map-1"
  },
  "metrics": {
    "path": "examples\\handoff\\detail-drawer-astronaut-form\\migration-metrics.json",
    "sha256": "60cb64821346c001e984eec143dd3c82a01a293ba6b557c6050ba6882af16df5"
  },
  "features": [
    {
      "id": "about",
      "title": "about",
      "paths": [
        "src/features/about"
      ]
    },
    {
      "id": "annotation-popup",
      "title": "annotationPopup",
      "paths": [
        "src/features/annotationPopup"
      ]
    },
    {
      "id": "bread-crumbs",
      "title": "breadCrumbs",
      "paths": [
        "src/features/breadCrumbs"
      ]
    },
    {
      "id": "copy",
      "title": "copy",
      "paths": [
        "src/features/copy"
      ]
    },
    {
      "id": "edit-page",
      "title": "editPage",
      "paths": [
        "src/features/editPage"
      ]
    },
    {
      "id": "floor-plan-creator",
      "title": "floorPlanCreator",
      "paths": [
        "src/features/floorPlanCreator"
      ]
    },
    {
      "id": "form-components",
      "title": "formComponents",
      "paths": [
        "src/features/formComponents"
      ]
    },
    {
      "id": "navbar",
      "title": "navbar",
      "paths": [
        "src/features/navbar"
      ]
    },
    {
      "id": "new-package-page",
      "title": "newPackagePage",
      "paths": [
        "src/features/newPackagePage"
      ]
    },
    {
      "id": "overview-page",
      "title": "overviewPage",
      "paths": [
        "src/features/overviewPage"
      ]
    },
    {
      "id": "recovery-route",
      "title": "recoveryRoute",
      "paths": [
        "src/features/recoveryRoute"
      ]
    },
    {
      "id": "robot",
      "title": "robot",
      "paths": [
        "src/features/robot"
      ]
    },
    {
      "id": "side-bar-filled",
      "title": "sideBarFilled",
      "paths": [
        "src/features/sideBarFilled"
      ]
    },
    {
      "id": "start-page",
      "title": "startPage",
      "paths": [
        "src/features/startPage"
      ]
    },
    {
      "id": "undo-redo",
      "title": "undoRedo",
      "paths": [
        "src/features/undoRedo"
      ]
    }
  ],
  "slices": [
    {
      "flowId": "detail-drawer-line-edit",
      "featureId": "floor-plan-creator",
      "title": "detailDrawer/lineForm — Length/Angle/Fence-offset fields (nested mount)",
      "paths": [
        "src/features/floorPlanCreator/detailDrawer/lineForm/LineForm.tsx",
        "src/features/floorPlanCreator/detailDrawer/lineForm/angular"
      ],
      "dependsOn": [],
      "requires": [
        "floor-plan-stores",
        "done-button",
        "form-wrapper",
        "navbar-delete-map-element",
        "map-object-distances",
        "radio-button-group",
        "element-creation-manager",
        "lely-red-rules",
        "details",
        "use-floor-plan-maker-detail-open",
        "icon",
        "text",
        "flex-wrapper",
        "full-flex-center",
        "use-robot-manager",
        "radio-button-with-icon",
        "set-first-point-icon",
        "info-image"
      ],
      "criteria": {
        "oneOwner": {
          "verdict": "pass",
          "note": "flow-baseline recorded this as the migrate set (flow-contract.json scope.allowedWritePaths)."
        },
        "noSharedInfrastructure": {
          "verdict": "pass",
          "note": "FocusNumberInput rebuilt locally under lineForm/angular, per project-constants.md."
        },
        "measurableNeighbour": {
          "verdict": "pass",
          "note": "Nested mount inside LineForm.tsx, which stays React (partialMount.retainedParent)."
        },
        "boundedBranches": {
          "verdict": "pass",
          "note": "One capability gate (FeedPush) for the fence-offset fields, per flow-contract.json."
        }
      },
      "status": "in-progress"
    },
    {
      "flowId": "detail-drawer-astronaut-form",
      "featureId": "floor-plan-creator",
      "title": "detailDrawer/astronautForm",
      "paths": [
        "src/features/floorPlanCreator/detailDrawer/astronautForm"
      ],
      "dependsOn": [],
      "requires": [
        "floor-plan-stores",
        "done-button",
        "form-wrapper",
        "navbar-delete-map-element",
        "map-object-distances",
        "radio-button-group",
        "element-creation-manager",
        "lely-red-rules",
        "radio-button",
        "details",
        "canvas-object-angle-input",
        "canvas-object-coordinates-details"
      ],
      "criteria": {
        "oneOwner": {
          "verdict": "pass",
          "note": "Folder is self-contained; no external importers found."
        },
        "noSharedInfrastructure": {
          "verdict": "pass",
          "note": "Only imports shared read-only helpers (DoneButton, FormWrapper, CanvasObjectAngleInput/CoordinatesDetails, distances/MapObjectDistances)."
        },
        "measurableNeighbour": {
          "verdict": "unknown",
          "note": "Whole-form swap vs. partial mount not yet decided; needs flow-baseline survey."
        },
        "boundedBranches": {
          "verdict": "pass",
          "note": "One conditional gate (properties.isPlaced) around distances/coordinates (AstronautForm.tsx:37)."
        }
      },
      "status": "candidate"
    },
    {
      "flowId": "detail-drawer-charger-form",
      "featureId": "floor-plan-creator",
      "title": "detailDrawer/chargerForm (incl. junoChargerForm, c2Properties)",
      "paths": [
        "src/features/floorPlanCreator/detailDrawer/chargerForm"
      ],
      "dependsOn": [],
      "requires": [
        "floor-plan-stores",
        "done-button",
        "form-wrapper",
        "navbar-delete-map-element",
        "floor-plan-maker-facade",
        "history-types",
        "radio-button-group",
        "element-creation-manager",
        "lely-red-rules",
        "radio-button",
        "details",
        "focus-number-input",
        "use-floor-plan-maker-detail-open",
        "icon",
        "text",
        "styled",
        "flex-wrapper",
        "protection-frame-icon",
        "object-risk-card",
        "distance-point-api",
        "floor-plan-converter",
        "sand-flush-icon",
        "check-box-with-icon"
      ],
      "criteria": {
        "oneOwner": {
          "verdict": "unknown",
          "note": "chargerForm/LabelText.tsx is also imported by dumpStationForm (LabelTextWithTopMargin) — a cross-folder dependency to resolve before cutting the write allowlist."
        },
        "noSharedInfrastructure": {
          "verdict": "unknown",
          "note": "Depends on the LabelText.tsx ownership question above."
        },
        "measurableNeighbour": {
          "verdict": "unknown",
          "note": "Two variants (ChargerForm/JunoChargerForm) selected by isJuno; needs flow-baseline survey."
        },
        "boundedBranches": {
          "verdict": "fail",
          "note": "3 conditional sections (water station, protection frame, isPlaced) plus the Juno/non-Juno switch in the parent (ChargerForm.tsx:50,60,70)."
        }
      },
      "status": "candidate"
    },
    {
      "flowId": "detail-drawer-corner-strip-form",
      "featureId": "floor-plan-creator",
      "title": "detailDrawer/cornerStripForm",
      "paths": [
        "src/features/floorPlanCreator/detailDrawer/cornerStripForm"
      ],
      "dependsOn": [],
      "requires": [
        "floor-plan-stores",
        "done-button",
        "form-wrapper",
        "navbar-delete-map-element",
        "map-object-distances",
        "floor-plan-maker-facade",
        "history-types",
        "radio-button-group",
        "element-creation-manager",
        "lely-red-rules",
        "radio-button",
        "canvas-object-angle-input",
        "canvas-object-coordinates-details",
        "focus-number-input",
        "icon",
        "text",
        "styled",
        "flex",
        "distance-point-api"
      ],
      "criteria": {
        "oneOwner": {
          "verdict": "pass",
          "note": "Folder is self-contained; no external importers found."
        },
        "noSharedInfrastructure": {
          "verdict": "pass",
          "note": "Only imports shared read-only helpers (DoneButton, FormWrapper, CanvasObjectAngleInput/CoordinatesDetails, distances/MapObjectDistances)."
        },
        "measurableNeighbour": {
          "verdict": "unknown",
          "note": "Whole-form swap vs. partial mount not yet decided; needs flow-baseline survey."
        },
        "boundedBranches": {
          "verdict": "pass",
          "note": "One conditional gate (properties.isPlaced) around distances/coordinates (index.tsx:48)."
        }
      },
      "status": "candidate"
    },
    {
      "flowId": "detail-drawer-dump-station-form",
      "featureId": "floor-plan-creator",
      "title": "detailDrawer/dumpStationForm",
      "paths": [
        "src/features/floorPlanCreator/detailDrawer/dumpStationForm"
      ],
      "dependsOn": [],
      "requires": [
        "floor-plan-stores",
        "done-button",
        "form-wrapper",
        "navbar-delete-map-element",
        "map-object-distances",
        "floor-plan-maker-facade",
        "history-types",